{
  "schemaVersion": 1,
  "generatedUtc": "2026-07-29T00:18:53.269815+00:00",
  "repositories": [
    {
      "id": "openclip-standard",
      "repository": "laion/CLIP-ViT-B-32-xlm-roberta-base-laion5B-s13B-b90k",
      "commit": "506d40eb551f4801a1c27fc20a31c7b8f590deda",
      "license": "MIT",
      "fileCount": 3,
      "diskBytes": 1473732296
    },
    {
      "id": "openclip-high",
      "repository": "laion/CLIP-ViT-H-14-frozen-xlm-roberta-large-laion5B-s13B-b90k",
      "commit": "f9ab955287d06ac45c7654f26fecd29301c70a1f",
      "license": "MIT",
      "fileCount": 3,
      "diskBytes": 4781484996
    },
    {
      "id": "bge-small",
      "repository": "BAAI/bge-small-zh-v1.5",
      "commit": "7999e1d3359715c523056ef9478215996d62a620",
      "license": "MIT",
      "fileCount": 11,
      "diskBytes": 192220929
    },
    {
      "id": "bge-base",
      "repository": "BAAI/bge-base-zh-v1.5",
      "commit": "f03589ceff5aac7111bd60cfc7d497ca17ecac65",
      "license": "MIT",
      "fileCount": 10,
      "diskBytes": 409689857
    },
    {
      "id": "bge-large",
      "repository": "BAAI/bge-large-zh-v1.5",
      "commit": "79e7739b6ab944e86d6171e44d24c997fc1e0116",
      "license": "MIT",
      "fileCount": 10,
      "diskBytes": 1302771424
    },
    {
      "id": "whisper-tiny",
      "repository": "Systran/faster-whisper-tiny",
      "commit": "d90ca5fe260221311c53c58e660288d3deb8d356",
      "license": "MIT",
      "fileCount": 4,
      "diskBytes": 78203619
    },
    {
      "id": "whisper-base",
      "repository": "Systran/faster-whisper-base",
      "commit": "ebe41f70d5b6dfa9166e2c581c45c9c0cfc57b66",
      "license": "MIT",
      "fileCount": 4,
      "diskBytes": 147882941
    },
    {
      "id": "whisper-small",
      "repository": "Systran/faster-whisper-small",
      "commit": "536b0662742c02347bc0e980a01041f333bce120",
      "license": "MIT",
      "fileCount": 4,
      "diskBytes": 486212372
    },
    {
      "id": "whisper-medium",
      "repository": "Systran/faster-whisper-medium",
      "commit": "08e178d48790749d25932bbc082711ddcfdfbc4f",
      "license": "MIT",
      "fileCount": 4,
      "diskBytes": 1530571735
    },
    {
      "id": "whisper-large-v3-turbo",
      "repository": "deepdml/faster-whisper-large-v3-turbo-ct2",
      "commit": "4df90f75321148c3a29a9e2351b7ddf8f5b115a8",
      "license": "MIT",
      "fileCount": 5,
      "diskBytes": 1621665983
    },
    {
      "id": "whisper-large-v3",
      "repository": "Systran/faster-whisper-large-v3",
      "commit": "edaa852ec7e145841d8ffdb056a99866b5f0a478",
      "license": "MIT",
      "fileCount": 5,
      "diskBytes": 3090835702
    },
    {
      "id": "ppocrv5-mobile-det",
      "repository": "PaddlePaddle/PP-OCRv5_mobile_det",
      "commit": "0d63e78e2b680928f6b1747d76a08db6e645efb7",
      "license": "Apache-2.0",
      "fileCount": 4,
      "diskBytes": 4926488
    },
    {
      "id": "ppocrv5-mobile-rec",
      "repository": "PaddlePaddle/PP-OCRv5_mobile_rec",
      "commit": "682f20538d8c086cb2128e5cfac775e6c4904e85",
      "license": "Apache-2.0",
      "fileCount": 4,
      "diskBytes": 17176987
    },
    {
      "id": "ppocrv5-server-det",
      "repository": "PaddlePaddle/PP-OCRv5_server_det",
      "commit": "ca867c897ecbca8873081573a802ad70d499cb94",
      "license": "Apache-2.0",
      "fileCount": 4,
      "diskBytes": 88339141
    },
    {
      "id": "ppocrv5-server-rec",
      "repository": "PaddlePaddle/PP-OCRv5_server_rec",
      "commit": "b26c3587fda8da3c8ec0ce357214b4d661ff1558",
      "license": "Apache-2.0",
      "fileCount": 4,
      "diskBytes": 85215919
    }
  ],
  "artifacts": [
    {
      "id": "openclip-standard-000",
      "kind": "visual",
      "version": "506d40eb551f4801a1c27fc20a31c7b8f590deda",
      "filename": "openclip-standard--open_clip_pytorch_model.bin",
      "installPath": "openclip-standard/open_clip_pytorch_model.bin",
      "size": 1464635263,
      "sha256": "a5412f19cca70db8d434f68361f7254bd322a553455a63dbb709bd6a650cf378",
      "primaryUrl": "https://huggingface.co/laion/CLIP-ViT-B-32-xlm-roberta-base-laion5B-s13B-b90k/resolve/506d40eb551f4801a1c27fc20a31c7b8f590deda/open_clip_pytorch_model.bin?download=true",
      "fallbackUrls": [],
      "license": "MIT",
      "vectorDimension": 512,
      "minimumWorkerVersion": "1.0.0",
      "recommendedVramBytes": 4294967296,
      "diskBytes": 1464635263
    },
    {
      "id": "openclip-standard-001",
      "kind": "visual",
      "version": "506d40eb551f4801a1c27fc20a31c7b8f590deda",
      "filename": "openclip-standard--preprocessor_config.json",
      "installPath": "openclip-standard/preprocessor_config.json",
      "size": 315,
      "sha256": "0a70aaa5de2ccb5e222b0e7e3ea347a3da051c3588c763cdd23b4d80bbf96b65",
      "primaryUrl": "https://huggingface.co/laion/CLIP-ViT-B-32-xlm-roberta-base-laion5B-s13B-b90k/resolve/506d40eb551f4801a1c27fc20a31c7b8f590deda/preprocessor_config.json?download=true",
      "fallbackUrls": [],
      "license": "MIT",
      "vectorDimension": 512,
      "minimumWorkerVersion": "1.0.0",
      "recommendedVramBytes": 4294967296,
      "diskBytes": 315
    },
    {
      "id": "openclip-standard-002",
      "kind": "visual",
      "version": "506d40eb551f4801a1c27fc20a31c7b8f590deda",
      "filename": "openclip-standard--tokenizer.json",
      "installPath": "openclip-standard/tokenizer.json",
      "size": 9096718,
      "sha256": "a898ea75433890f6610f4e470b8ebeb0c21dce5c8dd61f892eb09eb5919d2e2c",
      "primaryUrl": "https://huggingface.co/laion/CLIP-ViT-B-32-xlm-roberta-base-laion5B-s13B-b90k/resolve/506d40eb551f4801a1c27fc20a31c7b8f590deda/tokenizer.json?download=true",
      "fallbackUrls": [],
      "license": "MIT",
      "vectorDimension": 512,
      "minimumWorkerVersion": "1.0.0",
      "recommendedVramBytes": 4294967296,
      "diskBytes": 9096718
    },
    {
      "id": "openclip-high-000",
      "kind": "visual",
      "version": "f9ab955287d06ac45c7654f26fecd29301c70a1f",
      "filename": "openclip-high--open_clip_pytorch_model.bin",
      "installPath": "openclip-high/open_clip_pytorch_model.bin",
      "size": 4772387963,
      "sha256": "ee81ce53c8591d48ee5e7b390b2f10d502c721df5920c3096c6bdb54d1459881",
      "primaryUrl": "https://huggingface.co/laion/CLIP-ViT-H-14-frozen-xlm-roberta-large-laion5B-s13B-b90k/resolve/f9ab955287d06ac45c7654f26fecd29301c70a1f/open_clip_pytorch_model.bin?download=true",
      "fallbackUrls": [],
      "license": "MIT",
      "vectorDimension": 1024,
      "minimumWorkerVersion": "1.0.0",
      "recommendedVramBytes": 10737418240,
      "diskBytes": 4772387963
    },
    {
      "id": "openclip-high-001",
      "kind": "visual",
      "version": "f9ab955287d06ac45c7654f26fecd29301c70a1f",
      "filename": "openclip-high--preprocessor_config.json",
      "installPath": "openclip-high/preprocessor_config.json",
      "size": 315,
      "sha256": "0a70aaa5de2ccb5e222b0e7e3ea347a3da051c3588c763cdd23b4d80bbf96b65",
      "primaryUrl": "https://huggingface.co/laion/CLIP-ViT-H-14-frozen-xlm-roberta-large-laion5B-s13B-b90k/resolve/f9ab955287d06ac45c7654f26fecd29301c70a1f/preprocessor_config.json?download=true",
      "fallbackUrls": [],
      "license": "MIT",
      "vectorDimension": 1024,
      "minimumWorkerVersion": "1.0.0",
      "recommendedVramBytes": 10737418240,
      "diskBytes": 315
    },
    {
      "id": "openclip-high-002",
      "kind": "visual",
      "version": "f9ab955287d06ac45c7654f26fecd29301c70a1f",
      "filename": "openclip-high--tokenizer.json",
      "installPath": "openclip-high/tokenizer.json",
      "size": 9096718,
      "sha256": "a898ea75433890f6610f4e470b8ebeb0c21dce5c8dd61f892eb09eb5919d2e2c",
      "primaryUrl": "https://huggingface.co/laion/CLIP-ViT-H-14-frozen-xlm-roberta-large-laion5B-s13B-b90k/resolve/f9ab955287d06ac45c7654f26fecd29301c70a1f/tokenizer.json?download=true",
      "fallbackUrls": [],
      "license": "MIT",
      "vectorDimension": 1024,
      "minimumWorkerVersion": "1.0.0",
      "recommendedVramBytes": 10737418240,
      "diskBytes": 9096718
    },
    {
      "id": "bge-small-000",
      "kind": "text",
      "version": "7999e1d3359715c523056ef9478215996d62a620",
      "filename": "bge-small--1_Pooling--config.json",
      "installPath": "bge-small/1_Pooling/config.json",
      "size": 190,
      "sha256": "aaa8861589f80c961a03cc86c7eeaef7605c1676b9ab55329d33a304738769c6",
      "primaryUrl": "https://huggingface.co/BAAI/bge-small-zh-v1.5/resolve/7999e1d3359715c523056ef9478215996d62a620/1_Pooling/config.json?download=true",
      "fallbackUrls": [],
      "license": "MIT",
      "vectorDimension": 512,
      "minimumWorkerVersion": "1.0.0",
      "recommendedVramBytes": 0,
      "diskBytes": 190
    },
    {
      "id": "bge-small-001",
      "kind": "text",
      "version": "7999e1d3359715c523056ef9478215996d62a620",
      "filename": "bge-small--config.json",
      "installPath": "bge-small/config.json",
      "size": 776,
      "sha256": "3853a7979202c348751b753e36f579c41d8da7d36af617d3d907e1fc9b441f2a",
      "primaryUrl": "https://huggingface.co/BAAI/bge-small-zh-v1.5/resolve/7999e1d3359715c523056ef9478215996d62a620/config.json?download=true",
      "fallbackUrls": [],
      "license": "MIT",
      "vectorDimension": 512,
      "minimumWorkerVersion": "1.0.0",
      "recommendedVramBytes": 0,
      "diskBytes": 776
    },
    {
      "id": "bge-small-002",
      "kind": "text",
      "version": "7999e1d3359715c523056ef9478215996d62a620",
      "filename": "bge-small--config_sentence_transformers.json",
      "installPath": "bge-small/config_sentence_transformers.json",
      "size": 124,
      "sha256": "940d5f50db195fa6e5e6a4f122c095f77880de259d74b14a65779ed48bdd7c56",
      "primaryUrl": "https://huggingface.co/BAAI/bge-small-zh-v1.5/resolve/7999e1d3359715c523056ef9478215996d62a620/config_sentence_transformers.json?download=true",
      "fallbackUrls": [],